{
  "schemaVersion": "1",
  "packId": "switchyard-2d",
  "name": "Switchyard Courier Seed Registry",
  "description": "Switchyard Courier registry with verified CC0 top-down visual candidates plus explicit offline fallback placeholders.",
  "entries": [
    {
      "id": "kenney.topdown-shooter.robot.player",
      "genre": "topdown-2d",
      "primitive": "player",
      "kind": "sprite",
      "priority": 95,
      "placeholder": false,
      "source": {
        "title": "Top-down Shooter",
        "url": "https://kenney.nl/assets/top-down-shooter",
        "downloadPage": "https://kenney.nl/assets/top-down-shooter",
        "author": "Kenney",
        "verified": true,
        "provenance": {
          "verifiedAt": "2026-05-26",
          "origin": "Kenney Top-down Shooter CC0 pack; selected robot standing sprite from downloaded ZIP.",
          "fixture": "asset-layer/fixtures/switchyard/kenney-topdown-shooter/robot1_stand.png",
          "notes": "Top-down robot/courier avatar candidate for Switchyard proof."
        }
      },
      "license": {
        "name": "Creative Commons CC0 1.0 Universal",
        "spdx": "CC0-1.0",
        "url": "https://creativecommons.org/publicdomain/zero/1.0/",
        "requiresAttribution": false
      },
      "provider": {
        "name": "Kenney",
        "url": "https://kenney.nl/assets/top-down-shooter",
        "type": "local"
      },
      "files": [
        {
          "role": "sprite",
          "format": "png",
          "localPath": "asset-layer/fixtures/switchyard/kenney-topdown-shooter/robot1_stand.png",
          "checksum": {
            "algorithm": "sha256",
            "value": "1a307cd6405ade9b1c341eacc4b1234490d6e66305839de86517e2eeeede997c"
          }
        }
      ],
      "technical": {
        "width": 33,
        "height": 43,
        "pixelsPerUnit": 100,
        "transparent": true
      },
      "tags": [
        "topdown",
        "player",
        "robot",
        "courier",
        "kenney",
        "cc0"
      ],
      "unity": {
        "path": "Assets/Art/Sprites/Characters/kenney-robot-courier.png",
        "pixelsPerUnit": 100,
        "spriteMode": "single",
        "filterMode": "Point"
      }
    },
    {
      "id": "ansimuz.warped-tech-lab.tileset.arena",
      "genre": "topdown-2d",
      "primitive": "arena",
      "kind": "sprite",
      "priority": 92,
      "placeholder": false,
      "source": {
        "title": "Warped Top-Down Tech Lab",
        "url": "https://opengameart.org/content/warped-top-down-tech-lab",
        "downloadPage": "https://opengameart.org/content/warped-top-down-tech-lab",
        "author": "ansimuz",
        "verified": true,
        "provenance": {
          "verifiedAt": "2026-05-26",
          "origin": "OpenGameArt page lists CC0; selected Tileset.png from downloaded top_down_lab_files.zip.",
          "fixture": "asset-layer/fixtures/switchyard/ansimuz-topdown-tech-lab/Tileset.png",
          "notes": "Sci-fi lab tileset candidate for arena floor, walls, rails, sockets, and terminals; needs slicing before final import."
        }
      },
      "license": {
        "name": "Creative Commons CC0 1.0 Universal",
        "spdx": "CC0-1.0",
        "url": "https://creativecommons.org/publicdomain/zero/1.0/",
        "requiresAttribution": false
      },
      "provider": {
        "name": "OpenGameArt",
        "url": "https://opengameart.org/content/warped-top-down-tech-lab",
        "type": "local"
      },
      "files": [
        {
          "role": "spritesheet",
          "format": "png",
          "localPath": "asset-layer/fixtures/switchyard/ansimuz-topdown-tech-lab/Tileset.png",
          "checksum": {
            "algorithm": "sha256",
            "value": "2dbbdcd06e9f7aa97c7e6d7ea27281fcbe5af7bdf7067fb0d37bcf37659faaf4"
          }
        }
      ],
      "technical": {
        "width": 240,
        "height": 176,
        "pixelsPerUnit": 100,
        "transparent": true
      },
      "tags": [
        "topdown",
        "arena",
        "industrial",
        "lab",
        "tech",
        "tileset",
        "cc0"
      ],
      "unity": {
        "path": "Assets/Art/Sprites/Arena/ansimuz-warped-tech-lab-tileset.png",
        "pixelsPerUnit": 100,
        "spriteMode": "single",
        "filterMode": "Point"
      }
    },
    {
      "id": "kenney.topdown-shooter.orange-pad.hazard",
      "genre": "topdown-2d",
      "primitive": "hazard",
      "kind": "sprite",
      "priority": 84,
      "placeholder": false,
      "source": {
        "title": "Top-down Shooter",
        "url": "https://kenney.nl/assets/top-down-shooter",
        "downloadPage": "https://kenney.nl/assets/top-down-shooter",
        "author": "Kenney",
        "verified": true,
        "provenance": {
          "verifiedAt": "2026-05-26",
          "origin": "Kenney Top-down Shooter CC0 pack; selected circular orange tile from downloaded ZIP.",
          "fixture": "asset-layer/fixtures/switchyard/kenney-topdown-shooter/tile_197.png",
          "notes": "Readable orange circular pad candidate for telegraphed danger zones, pressure plates, or delivery sockets."
        }
      },
      "license": {
        "name": "Creative Commons CC0 1.0 Universal",
        "spdx": "CC0-1.0",
        "url": "https://creativecommons.org/publicdomain/zero/1.0/",
        "requiresAttribution": false
      },
      "provider": {
        "name": "Kenney",
        "url": "https://kenney.nl/assets/top-down-shooter",
        "type": "local"
      },
      "files": [
        {
          "role": "sprite",
          "format": "png",
          "localPath": "asset-layer/fixtures/switchyard/kenney-topdown-shooter/tile_197.png",
          "checksum": {
            "algorithm": "sha256",
            "value": "f5561b5cf4539da0789edc7017ef4a25084b5cd28c6b673a07a85edcb7f50ef9"
          }
        }
      ],
      "technical": {
        "width": 64,
        "height": 64,
        "pixelsPerUnit": 100,
        "transparent": true
      },
      "tags": [
        "topdown",
        "hazard",
        "telegraph",
        "pad",
        "kenney",
        "cc0"
      ],
      "unity": {
        "path": "Assets/Art/Sprites/Hazards/kenney-orange-pad.png",
        "pixelsPerUnit": 100,
        "spriteMode": "single",
        "filterMode": "Point"
      }
    },
    {
      "id": "kenney.topdown-shooter.blue-socket.terminal",
      "genre": "topdown-2d",
      "primitive": "terminal",
      "kind": "sprite",
      "priority": 82,
      "placeholder": false,
      "source": {
        "title": "Top-down Shooter",
        "url": "https://kenney.nl/assets/top-down-shooter",
        "downloadPage": "https://kenney.nl/assets/top-down-shooter",
        "author": "Kenney",
        "verified": true,
        "provenance": {
          "verifiedAt": "2026-05-26",
          "origin": "Kenney Top-down Shooter CC0 pack; selected blue socket/floor tile from downloaded ZIP.",
          "fixture": "asset-layer/fixtures/switchyard/kenney-topdown-shooter/tile_131.png",
          "notes": "Simple readable blue socket/delivery pad candidate; final game may prefer Ansimuz terminal slices."
        }
      },
      "license": {
        "name": "Creative Commons CC0 1.0 Universal",
        "spdx": "CC0-1.0",
        "url": "https://creativecommons.org/publicdomain/zero/1.0/",
        "requiresAttribution": false
      },
      "provider": {
        "name": "Kenney",
        "url": "https://kenney.nl/assets/top-down-shooter",
        "type": "local"
      },
      "files": [
        {
          "role": "sprite",
          "format": "png",
          "localPath": "asset-layer/fixtures/switchyard/kenney-topdown-shooter/tile_131.png",
          "checksum": {
            "algorithm": "sha256",
            "value": "2fcdf2c2be795a7718c1abdab413877b71e965c26a46368260a70543993e6619"
          }
        }
      ],
      "technical": {
        "width": 64,
        "height": 64,
        "pixelsPerUnit": 100,
        "transparent": true
      },
      "tags": [
        "topdown",
        "terminal",
        "socket",
        "delivery",
        "kenney",
        "cc0"
      ],
      "unity": {
        "path": "Assets/Art/Sprites/Objectives/kenney-blue-socket.png",
        "pixelsPerUnit": 100,
        "spriteMode": "single",
        "filterMode": "Point"
      }
    },
    {
      "id": "opengameart.airos.electronics.usb-charge.battery",
      "genre": "topdown-2d",
      "primitive": "battery",
      "kind": "sprite",
      "priority": 90,
      "placeholder": false,
      "source": {
        "title": "32px Electronics",
        "url": "https://opengameart.org/content/32px-electronics",
        "downloadPage": "https://opengameart.org/content/32px-electronics",
        "author": "Airos",
        "verified": true,
        "provenance": {
          "verifiedAt": "2026-05-26",
          "origin": "OpenGameArt 32px Electronics page lists CC0 and provides electronics_full_sheet.png plus per-item ZIPs; selected and cropped a red USB-stick sprite as a readable charge pickup.",
          "fixture": "asset-layer/fixtures/switchyard/airos-32px-electronics/usb-red-charge.png",
          "notes": "Carryable charge/battery pickup candidate for Switchyard Courier. Source sheet is also committed for audit."
        }
      },
      "license": {
        "name": "Creative Commons CC0 1.0 Universal",
        "spdx": "CC0-1.0",
        "url": "https://creativecommons.org/publicdomain/zero/1.0/",
        "requiresAttribution": false
      },
      "provider": {
        "name": "OpenGameArt",
        "url": "https://opengameart.org/content/32px-electronics",
        "type": "local"
      },
      "files": [
        {
          "role": "sprite",
          "format": "png",
          "localPath": "asset-layer/fixtures/switchyard/airos-32px-electronics/usb-red-charge.png",
          "checksum": {
            "algorithm": "sha256",
            "value": "bd24bdfb0ae67fdd709a384076314d6e2701b3c9f320efece36b8b847ab42637"